{
  "count": 0,
  "verdict": "pass",
  "offenders": [],
  "checked": [
    "전수 커버 대조: changes.new_features 의 21개 신규 id 각각을 update-manual.md 의 '## ' 헤더(grep 추출)와 1:1 대조 — 21개 모두 자기 섹션 보유, 섹션 없는 id 0건",
    "알맹이 존재 대조: 21개 섹션 모두 '무엇/왜'(summary+value) + '어떻게'(method+path+auth+params) + 예제(요청·응답 or 페이로드) + 개인정보 주의 4요소 채움 — 빈 껍데기 0건",
    "PII 알맹이 대조: has_pii=true 8건(user.get·user.upsert·user.event.create·message.list·manager.list·manager.get·webhook.message.created·webhook.user.created)은 pii_fields+policy_flag 명시, has_pii=false 13건은 'pii_fields 없음' 등 비대상 사유 명시",
    "webhook 3건(inferred) 대조: [inferred]·문서 검증 필요 배지 + POST(구독자 콜백 URL) + x-signature(HMAC) auth + 페이로드 예제 + CB 서명검증 주의까지 알맹이 확인",
    "범위 정합: counts.new(21) == 매뉴얼 feature 섹션 수(21), changes 밖 id 를 새로 다룬 섹션 0건 (직전 저장본이 참조하던 22-id·openapi.user.list 는 이 run 의 changes.json 에 없어 폐기)"
  ],
  "sampled_ids": [
    "openapi.user.get",
    "openapi.user.upsert",
    "openapi.user.delete",
    "openapi.user.event.create",
    "openapi.userchat.list",
    "openapi.userchat.get",
    "openapi.user.userchats.list",
    "openapi.user.userchats.create",
    "openapi.userchat.sessions.list",
    "openapi.message.list",
    "openapi.message.send",
    "openapi.group.message.send",
    "openapi.manager.list",
    "openapi.manager.get",
    "openapi.group.list",
    "openapi.bot.create",
    "openapi.bot.list",
    "openapi.channel.get",
    "webhook.message.created",
    "webhook.userchat.opened",
    "webhook.user.created"
  ],
  "fixes": []
}
