{
  "count": 0,
  "verdict": "pass",
  "offenders": [],
  "checked": [
    "changes.new_features 신규 14 id 전수를 update-manual.md 섹션 제목(### 1~### 14, 각 제목에 backtick id 명시)과 1:1 대조 — 14/14 자기 섹션 존재, 매칭 누락 0",
    "각 섹션에서 무엇/왜(summary+value) 알맹이와 어떻게(method+path+auth+params+예제 요청/응답) 알맹이가 둘 다 존재하는지 확인 — 14/14 껍데기 없음. OpenAPI 11건 x-access-key/x-access-secret · webhook 3건 x-signature(HMAC)로 auth 명시",
    "부록 요약표(신규 14건)가 14 id 전수를 method+path+dir+provenance+PII 로 재확인 — changes.counts.new=14 및 각 필드값과 일치",
    "범위 밖 id 추가 여부 확인 — 코어 7건은 서두에서 명시 제외(재기술 안 함), changes 밖 신규 id 도입 없음"
  ],
  "sampled_ids": [
    "openapi.user.upsert",
    "openapi.user.delete",
    "openapi.user.event.create",
    "openapi.user.userchats.create",
    "openapi.userchat.sessions.list",
    "openapi.group.message.send",
    "openapi.manager.get",
    "openapi.group.list",
    "openapi.bot.create",
    "openapi.bot.list",
    "openapi.channel.get",
    "webhook.message.created",
    "webhook.userchat.opened",
    "webhook.user.created"
  ],
  "fixes": []
}
