{
  "count": 0,
  "verdict": "pass",
  "offenders": [],
  "checked": [
    "has_pii=true 5건(openapi.user.upsert · openapi.user.event.create · openapi.manager.get · webhook.message.created · webhook.user.created) 모두 방향별 개인정보 주의 섹션 존재 확인 (changes.json new_with_pii=5 와 일치)",
    "방향 정합 §6: W 2건(user.upsert L45-46 · user.event.create L102-103)='개인정보 외부 전송 → 수집·이용 동의 범위 + 위탁/제3자 제공 검토' 명시 / R 1건(manager.get L215-216)='필요 필드만 요청·화면노출 최소화·마스킹' 명시 / CB 2건(message.created L357-358 · user.created L411-412)='x-signature(HMAC) 서명 검증 선통과 + 수신 본문/유입 PII 마스킹' 명시 — 5/5 §6 방향 규칙 일치",
    "policy_flag: changes.json new_features 14건 전부 policy_flag=null, counts.policy_hold=0 — 매뉴얼 L14 가 pii_policy=consent 하에 hold_pii_transmit/mask_inbound 미해당(policy_hold=0)임을 정확 반영, 부록 L437 도 전건 null 명시. 누락 policy 문구 없음",
    "예제 secret 누출: update-manual.md 전 예제 grep -E '[A-Za-z0-9+/]{24,}={0,2}' → 실 base64/hex 토큰 0건. 인증값은 <KEY>×13·<SECRET>×13·<SIGNATURE>×4 플레이스홀더만. header 의 spec_lock sha256(57249a6c…)·합성 id(u_1·mgr_1·uc_1 등)는 credential/실PII 아님",
    "예제 실 PII 누출: 실 이메일 0건·실 전화번호 0건(정규식 스캔 확인). name/email/mobile/plainText 자리에 <PII:name>×4·<PII:email>×4·<PII:mobile>×1·<PII:plainText>×1 플레이스홀더만, 자유값도 <event>·<value>·<message>·<bot>·<group>·<channel> 플레이스홀더",
    "non-PII 항목의 방어적 주의(user.delete·userchats.create·sessions.list·group.message.send·group.list·bot.create·bot.list·channel.get·webhook.userchat.opened)는 요구 아닌 부가 주의 — 방향 오지정 없어 감점 대상 아님"
  ],
  "sampled_ids": [
    "openapi.user.upsert",
    "openapi.user.event.create",
    "openapi.manager.get",
    "webhook.message.created",
    "webhook.user.created"
  ],
  "fixes": []
}
